{
  "type": "CLEANUP_LEDGER",
  "schemaVersion": 1,
  "policy": "No scattered source path should be deleted until a ledger entry records its canonical replacement, verification evidence, and backup or rollback path. Broken symlinks may be trimmed after the ledger records the observed link, missing target, verification source, and rollback note.",
  "entries": [
    {
      "type": "CLEANUP_ENTRY",
      "sourceRoot": "claude-agents",
      "sourcePath": "code-documentation-generator.md",
      "observedPath": "/Users/amichne/.claude/agents/code-documentation-generator.md",
      "targetPath": "/Users/amichne/code/examplar/common/agents/code-documentation-generator.md",
      "decision": "REMOVE_BROKEN_SYMLINK",
      "status": "EXECUTED",
      "verification": "garden/manifests/consolidation-report.json reports this runtime link as broken with no existing target.",
      "rollback": "Recreate the symlink only if a replacement target is restored and reviewed."
    },
    {
      "type": "CLEANUP_ENTRY",
      "sourceRoot": "claude-agents",
      "sourcePath": "codebase-uplift-agent.md",
      "observedPath": "/Users/amichne/.claude/agents/codebase-uplift-agent.md",
      "targetPath": "/Users/amichne/code/examplar/common/agents/codebase-uplift-agent.md",
      "decision": "REMOVE_BROKEN_SYMLINK",
      "status": "EXECUTED",
      "verification": "garden/manifests/consolidation-report.json reports this runtime link as broken with no existing target.",
      "rollback": "Recreate the symlink only if a replacement target is restored and reviewed."
    },
    {
      "type": "CLEANUP_ENTRY",
      "sourceRoot": "claude-agents",
      "sourcePath": "kotlin-idiom-forge.agent.md",
      "observedPath": "/Users/amichne/.claude/agents/kotlin-idiom-forge.agent.md",
      "targetPath": "/Users/amichne/code/examplar/common/agents/kotlin-idiom-forge.agent.md",
      "decision": "REMOVE_BROKEN_SYMLINK",
      "status": "EXECUTED",
      "verification": "garden/manifests/consolidation-report.json reports this runtime link as broken with no existing target.",
      "rollback": "Recreate the symlink only if a replacement target is restored and reviewed."
    },
    {
      "type": "CLEANUP_ENTRY",
      "sourceRoot": "claude-agents",
      "sourcePath": "prompt-enhancer.md",
      "observedPath": "/Users/amichne/.claude/agents/prompt-enhancer.md",
      "targetPath": "/Users/amichne/code/examplar/common/agents/prompt-enhancer.md",
      "decision": "REMOVE_BROKEN_SYMLINK",
      "status": "EXECUTED",
      "verification": "garden/manifests/consolidation-report.json reports this runtime link as broken with no existing target.",
      "rollback": "Recreate the symlink only if a replacement target is restored and reviewed."
    },
    {
      "type": "CLEANUP_ENTRY",
      "sourceRoot": "global-agent-skills",
      "sourcePath": "design-an-interface",
      "observedPath": "/Users/amichne/.agents/skills/design-an-interface",
      "targetPath": "/Users/amichne/code/examplar/common/skills/design-an-interface",
      "decision": "REMOVE_BROKEN_SYMLINK",
      "status": "EXECUTED",
      "verification": "garden/manifests/consolidation-report.json reports this runtime link as broken with no existing target.",
      "rollback": "Recreate the symlink only if a replacement target is restored and reviewed."
    },
    {
      "type": "CLEANUP_ENTRY",
      "sourceRoot": "global-agent-skills",
      "sourcePath": "karpathy-guidelines",
      "observedPath": "/Users/amichne/.agents/skills/karpathy-guidelines",
      "targetPath": "/Users/amichne/code/examplar/common/skills/karpathy-guidelines",
      "decision": "REMOVE_BROKEN_SYMLINK",
      "status": "EXECUTED",
      "verification": "garden/manifests/consolidation-report.json reports this runtime link as broken with no existing target.",
      "rollback": "Recreate the symlink only if a replacement target is restored and reviewed."
    },
    {
      "type": "CLEANUP_ENTRY",
      "sourceRoot": "global-agent-skills",
      "sourcePath": "kast",
      "observedPath": "/Users/amichne/.agents/skills/kast",
      "targetPath": "/Users/amichne/.kast/lib/skills/kast",
      "decision": "REMOVE_BROKEN_SYMLINK",
      "status": "EXECUTED",
      "verification": "garden/manifests/consolidation-report.json reports this runtime link as broken with no existing target.",
      "rollback": "Recreate the symlink only if a replacement target is restored and reviewed."
    },
    {
      "type": "CLEANUP_ENTRY",
      "sourceRoot": "global-codex-backups",
      "sourcePath": "find-skills",
      "observedPath": "/Users/amichne/.codex/backups/find-skills",
      "targetPath": "../../.agents/skills/find-skills",
      "decision": "REMOVE_BROKEN_SYMLINK",
      "status": "EXECUTED",
      "verification": "garden/manifests/consolidation-report.json reports this runtime link as broken with no existing target.",
      "rollback": "Recreate the symlink only if a replacement target is restored and reviewed."
    },
    {
      "type": "CLEANUP_ENTRY",
      "sourceRoot": "global-codex-skills-backup",
      "sourcePath": "arch-review",
      "observedPath": "/Users/amichne/.codex/skills.backup/arch-review",
      "targetPath": "/Users/amichne/code/apollo/skills/arch-review",
      "decision": "REMOVE_BROKEN_SYMLINK",
      "status": "EXECUTED",
      "verification": "garden/manifests/consolidation-report.json reports this runtime link as broken with no existing target.",
      "rollback": "Recreate the symlink only if a replacement target is restored and reviewed."
    },
    {
      "type": "CLEANUP_ENTRY",
      "sourceRoot": "global-codex-skills-backup",
      "sourcePath": "documentation",
      "observedPath": "/Users/amichne/.codex/skills.backup/documentation",
      "targetPath": "/Users/amichne/code/examplar/common/skills/documentation",
      "decision": "REMOVE_BROKEN_SYMLINK",
      "status": "EXECUTED",
      "verification": "garden/manifests/consolidation-report.json reports this runtime link as broken with no existing target.",
      "rollback": "Recreate the symlink only if a replacement target is restored and reviewed."
    },
    {
      "type": "CLEANUP_ENTRY",
      "sourceRoot": "global-codex-skills-backup",
      "sourcePath": "segment-codebase-agents-md",
      "observedPath": "/Users/amichne/.codex/skills.backup/segment-codebase-agents-md",
      "targetPath": "/Users/amichne/code/examplar/common/skills/segment-codebase-agents-md",
      "decision": "REMOVE_BROKEN_SYMLINK",
      "status": "EXECUTED",
      "verification": "garden/manifests/consolidation-report.json reports this runtime link as broken with no existing target.",
      "rollback": "Recreate the symlink only if a replacement target is restored and reviewed."
    },
    {
      "type": "CLEANUP_ENTRY",
      "sourceRoot": "global-codex-skills-backup",
      "sourcePath": "tdd",
      "observedPath": "/Users/amichne/.codex/skills.backup/tdd",
      "targetPath": "/Users/amichne/code/examplar/common/skills/tdd",
      "decision": "REMOVE_BROKEN_SYMLINK",
      "status": "EXECUTED",
      "verification": "garden/manifests/consolidation-report.json reports this runtime link as broken with no existing target.",
      "rollback": "Recreate the symlink only if a replacement target is restored and reviewed."
    },
    {
      "type": "CLEANUP_ENTRY",
      "sourceRoot": "global-codex-skills-backup",
      "sourcePath": "yeet",
      "observedPath": "/Users/amichne/.codex/skills.backup/yeet",
      "targetPath": "/Users/amichne/code/examplar/common/skills/yeet",
      "decision": "REMOVE_BROKEN_SYMLINK",
      "status": "EXECUTED",
      "verification": "garden/manifests/consolidation-report.json reports this runtime link as broken with no existing target.",
      "rollback": "Recreate the symlink only if a replacement target is restored and reviewed."
    },
    {
      "type": "CLEANUP_ENTRY",
      "sourceRoot": "apollo-skills",
      "sourcePath": "define-goal",
      "observedPath": "/Users/amichne/code/apollo/skills/define-goal",
      "targetPath": "skills/define-goal",
      "canonicalPath": "skills/define-goal",
      "reviewEvidence": {
        "type": "SOURCE_REVIEW_EVIDENCE",
        "manifest": "garden/manifests/source-review-decisions.json",
        "targetPrimitiveType": "SKILL",
        "targetName": "define-goal",
        "sourceSha256": "sha256:e988680dcf9a18be5e5b0891b959a76d3e3889f0c1b56620f50e4c00306dc169",
        "decision": "COVERED_BY_CANONICAL"
      },
      "decision": "REPLACE_WITH_SYMLINK",
      "status": "EXECUTED",
      "verification": "Runtime trim execution replaced the Apollo skill directory with a symlink to the canonical skill after preserving the original at .migration-backups/source-turnoff/apollo-skills/define-goal.",
      "rollback": "Remove the symlink at /Users/amichne/code/apollo/skills/define-goal and move .migration-backups/source-turnoff/apollo-skills/define-goal back to that path."
    },
    {
      "type": "CLEANUP_ENTRY",
      "sourceRoot": "apollo-skills",
      "sourcePath": "doc-coauthoring",
      "observedPath": "/Users/amichne/code/apollo/skills/doc-coauthoring",
      "targetPath": "skills/reference-doc-workflow",
      "canonicalPath": "skills/reference-doc-workflow",
      "reviewEvidence": {
        "type": "SOURCE_REVIEW_EVIDENCE",
        "manifest": "garden/manifests/source-review-decisions.json",
        "targetPrimitiveType": "SKILL",
        "targetName": "reference-doc-workflow",
        "sourceSha256": "sha256:fd8325cb199c45d53792e9fbc144d72832900c77aa31bc3b781099d5cbe81266",
        "decision": "COVERED_BY_CANONICAL"
      },
      "decision": "REPLACE_WITH_SYMLINK",
      "status": "EXECUTED",
      "verification": "Runtime trim execution replaced the Apollo skill directory with a symlink to the canonical skill after preserving the original at .migration-backups/source-turnoff/apollo-skills/doc-coauthoring.",